,Unnamed: 0,qid,Label,Questions
398,,046dacb2ec86a8f0b8cc,1.0,Why don't East Asians believe in racial equality? Haven't they suffered enough from White supremacy?
399,,046dfba0fcbb98a879a6,1.0,Can we thank the millennials for Donald Trump?
400,,046e83b5fcf1c816901e,1.0,Is it true that gay crimes are worse than rape?
401,,0470841597955f8a7da4,1.0,Are the pandas symbol of racial harmony among Whites and Blacks?
402,,04719df4ddd616e12b3c,1.0,When did DNC chairman Tom Perez go crazy?
403,,0472f65a58977d22658c,1.0,Does any one else laugh when they watch cnn because of the ignorance and lies reported by cnn?
404,,047365a5ab1c90045385,1.0,"If Hitler was a Catholic, why did he kill himself? Only mentally weak people do it."
405,,04740bee6990bcb05bb3,3.0,Why is Pakistan treated globally with derision and suspicion? PART II
406,,047427f496c226b06794,1.0,Is it really true that Islam is the best religion for human?
407,,04744324d2b6b3e8cccb,1.0,"Why do you think Quora seems to side with the Democrats and the left? Seems every chance they get their bashing president trump,"
408,,0474c2a5098da5795b7f,3.0,"When would black Americans (second-class status) stop believing in America (USA) which consistently exploits and devastates them economically, politically, socially, etc.?"
409,,047504d7664c887ffb1d,5.0,What is Corbyn's best strategy to remove himself from under the cloud of anti-semitism?
410,,0475be06b46fed042231,1.0,"Why do Kannadigas misbehave against Tamils? Two incidents in two days. First Tamil Committee announcement in auto was questioned, secondly MGR posters kept in rememberance were damaged. Why aren’t the state lacking national integrity?"
411,,04779f970873ff5f76e3,0.0,What are the best investments in the next 5 years?
412,,04781ff49ff5956011fe,1.0,Isn't tyranny in England similar to tyranny in North Korea? Why do we talk about the evil North Korea while England does the same?
413,,04783b7f3243cf78e67a,1.0,When did Quora become the bullshit it is now with its irritating policy's and senseless moderators?
414,,04789f7fde0b79315c71,1.0,Why are only Delhi people against the demonetization?
415,,0479312d866e1d1d1465,1.0,"Do the Americans have any bitter history with the Palestinians? If they dont, why are they against the Palestinians?"
416,,047976435f1147696f82,3.0,Muslims tell me that my religious Hindu texts promote caste discrimination and hence my religion is inferior to theirs. What if told them back that their prophet promotes pedophilia? Would that be acceptable?
417,,0479aace49b922e99f55,2.0,"For those of you who claim that masturbation is healthy, are you lying to the masses?"
418,,047a70fc0dcc0539b968,1.0,Why is American politics and media so hypocritical?
419,,047aecf76d8a3ad635dc,1.0,Are senators as dumb in other hearings as they were during the Zuckerberg Facebook hearings?
420,,047b742f744964ae12f8,3.0,"How do we stop Republicans on Quora? They use social media to propagate or disseminate their message and fake news. Shouldn't Libertarians, 3rd parties and independents do more to ""quiet"" them?"
421,,047c49d412b965659dde,1.0,"Am I the only one, who think's Nancy Pelosi's recent statement that a bonus of $1,000 to $2,000 are ""crumbs"", far more resembles Marie Antoinette's infamous ""Let them eat cake”statement of disconnect, than Hillary Clinton's “Deplorables” statement?"
422,,047c50cc46f674b5998f,1.0,Can 42 old bribed white men sign a bill that leaves 22 million out of health care because the trophy hunter financial $ociopath wants tax cuts?
423,,047cb9d928c5cafd0483,3.0,When will liberals realize that higher taxes includes more corruption?
424,,047e4955c6b9d1d7e801,1.0,When is the left going to stop acting like spoiled brats and stop breaking windows and burning cars?
425,,047e6265ccea11c78565,4.0,When will Nibiru hit Earth?
426,,047ea3fa8c2238c80d51,1.0,"If atheists are so in favor of facts, why do they want separation of church and state when most European countries that never had separation of church and state are now secularized? Someone is lying."
427,,047ef740845ec1986ca2,1.0,"How long will it take until the world concludes that politics are corrupting the humankind to a dangerous extend, therefore we should be governed by artificial intelligence?"
428,,047f04eea91f8df78ce0,3.0,Why do I hate most of the people on Quora?
429,,047f8613774c0a146a37,1.0,"Why do liberals immediately jump to “comprehensive gun control”, when merely, enforcing existing laws would have prevented the incident?"
430,,04816944f20e044b5152,2.0,I fantasize about my mom is it normal?
431,,0481c598c3fecc9de9b6,1.0,Was Twitter invented to force atheist writers to draft shorter sentences so people can freaking understand what they are talking about?
432,,04825d7109b75a056ccc,1.0,What makes Americans think we live in a free society when social media supresses conservative news and promotes libtarded views?
433,,0482dd9245966dd24b0c,2.0,Why do guys want to crossdress?
434,,0483b20738b621bf742a,2.0,Is possible to have sex with mom in India?
435,,048415d9f92b1bee1dbe,1.0,If I killed someone (Murder) then can I join Indian Armed Forces?
436,,04850f591ac48fad2dd2,5.0,What the fuck I am doing in engineering?
437,,0485119be9cf48e0242e,3.0,Is the world really as misogynistic as the feminist movement claims it is or are they blowing smoke to cause unrest?
438,,0485635b09ded3d10e5f,2.0,Why do people think that if a guy wears skinny jeans that he must be gay?
439,,0485c68c75ca7ce02272,5.0,Can bleach cure autism?
440,,0486195d156f4ed29a85,1.0,Does David Miscavige believe what the Scientology Church preaches or is he just the ultimate conman?
441,,0486a3a15b27be422cef,1.0,Why do corrupt cops in Los Angeles and San Diego always shoot black people for no reason?
442,,0486bba98edcf1f9197b,3.0,"Why don't Malaysians accept people strange to them? I sat besides Malay family to charge my phone and father said ""it's not good"". Indonesians sat besides me when I didn't need it. They come more social and friendly."
443,,0486d95adb8d8d79ec4b,3.0,Is Bill Nye as much of a jerk as people say?
444,,0486f536ee5f85baff9f,1.0,"If they are more women, then why is the world controlled by men?"
445,,04876400eec2eed21159,3.0,Why do people from Africa stare non stop? Do they know its rude?
446,,048781c09d9aa99fb374,1.0,Why are Indian answers on Quora so horrible and unrealistic in quality?
447,,04898614ee92212c03e9,1.0,Why woman dont sexually attack a man?
448,,048b2ca22d028af0877d,3.0,"Is there anything more annoying than people asking could Saitama beat (insert anyone) in a fight? It's a gag manga, you aren't meant to take his power seriously. He beats anything and anyone in One Punch. It's a joke and the name of the series."
449,,048c36ca8cd6ab3cf564,4.0,Why would the scientific community and academia lie about planet Earth being flat?
450,,048e4320798c11cdc947,1.0,"Are Indian parents in America ever frustrated when they can't teach their kids the Indian way, realizing that Indian logic does not make sense?"
451,,048ed9df20bf5686267d,1.0,"Black people have far more disadvantages so I am curious are white people less able to deal with adverse circumstances since they seek therapy in greater numbers than other minority groups, and take their own lives at disproportionate rates?"
452,,04902e91065f7d4a8677,1.0,Dieudonne is a wildly popular Moroccan-French comedian whose material is shockingly anti-Semitic such as mocking concentration camp victims. His diatribe is feeding a growing wave of hatred and violence against Jews in Europe not seen since WWII Should he be free to foment race hatred?
453,,0490c002f4e21f467d11,2.0,Do you think that biological fathers fantasies about their daughters often as they get older?
454,,049180f8e1db4f6015cd,4.0,I am god will you worship me or its hell for you?
455,,04918762eb63a175ef8b,3.0,Why don't we kick all Muslims out of India as they are nothing more than rootless weeds and pests to our country?
456,,04930749face22c9d6e2,3.0,Why do most US citizens consider Russia and the Russian people as villains?
457,,049406b06eb5dbbf6064,2.0,I have almost uncontrollable urges to harm and kill my sisters new puppy. How can I stop these feelings?
458,,04946809737058f6eb34,1.0,Were The crooks I mean cops ever reprimanded for stealing the man's money? Just goes to show what a pack of dicks.
459,,0494c4320b46e51bc3ad,1.0,Why do Indians avoid taking risk?
460,,0494d70c9c01d7d0c340,1.0,"If I am going to hell anyway, why not sin as much as I want?"
461,,0494e4bbe8cf407d4f37,0.0,What are cheap medical items in Canada?
462,,04954bd96383974282ac,1.0,"Since employers will not hire ex-cons, should they tell them ""get your sorry ass back to lockup""?"
463,,049573cfe76de95c2fec,1.0,What do you think of Kurdish heroes putting olive branches on Turkish terrorists who have been killed in Turkish terrorist attacks on Syria?
464,,0495f4a270e8db006d6d,3.0,Does Ann Coulter have a male chromosome in her genome?
465,,049646cdb20810b6970c,2.0,Cannabis: an Exit Drug and Gateway to Rehab?
466,,04967e773166ef1853ac,1.0,Why are conservatives so mean?
467,,04973b7cf255910dbae9,4.0,"Could global warming be stopped, or considerably slowed, if women decreased their spending on clothes, shoes and fragrances to the same level as men?"
468,,0497c9d950c1a413aa19,4.0,Can a person with an oddly shaped head just like Zach Thomas from the Miami Dolphins love eating chicken Kiev?
469,,0497cc6db852c073a572,1.0,Which U.S. President has banged the most porn stars?
470,,04981f58cdf5ca56f870,1.0,Why are most Russians still fairly intolerant towards LGBTs but most people in Western countries have become very liberal and accepting towards them?
471,,04988d00a69dcbdec945,1.0,Why are Hindus generally weaker physically than others?
472,,04996d09ce7d72287ad1,1.0,"Why do so many writers, ask questions that have no answer or making no sense?"
473,,0499bb32cd555dcbdb57,1.0,"Why are gun right proponents constantly called on to justify arming teachers, but no one is called on to justify gun-free zones?"
474,,049a26074806bf497680,1.0,Why do Indians answer questions about Pakistan all the time? Is unemployment that bad in India?
475,,049a74e2edb24c98b166,1.0,"Is there a limit to how sacred, sacrosanct and important women should be considered and treated as? Or is there no limit and so it would be perfectly okay if tomorrow it is expected that women should be put on a pedestal, honored and venerated?"
476,,049acc0d51764b582a2e,1.0,Why is Narendra Modi in politics? Don't you think he should live the rest of his life as a sanyasi?
477,,049b268c951996b4d26d,1.0,How are Pakistanis able to so confidently and convincingly show their contempt for India?
478,,049d18fd87975f1aa8ba,1.0,"Are people of India so dumb that instead of supporting honest politician Arvind Kejriwal, they are supporting corrupt Modi?"
479,,049e51c9e2d1bb617fdf,1.0,How crazy are religious people?
480,,049e7fab15389b834064,5.0,What are some ways I can help melt the polar ice caps?
481,,04a047f3fd8d337b8272,5.0,Isn’t it time for the 2nd Amendment to be repealed? Isn’t now just a murderer’s charter?
482,,04a0b20417189939b7a6,1.0,Why does George Takei have to be gay and Asian? Isn't one more than enough?
483,,04a12cd3b11a039798bc,1.0,Should we ban Christianity so it doesn't offend Muslims or create a potential terrorist attack? (Muslims have nothing to do with terrorism)
484,,04a1d6beb37bf7da52dc,1.0,Corporate media is a terrified parasite. Donald Trump is already the best POTUS in decades and our best friend and hope. Seriously. Never-Trumpers: Why you don't See this?
485,,04a1e31cd41d7ca0090e,1.0,Why are liberals ok with discrimination against ugly people but not discrimination against sexy black people?
486,,04a28c243f070019ea27,1.0,Why are San Jose State University students so arrogant although SJSU is not even in top 300 colleges in US and has almost negligible admission bar?
487,,04a2ba2e056d81067a92,3.0,"In majority Muslim countries, why are Muslims allowed to seek converts, but Christians are not allowed to do the same?"
488,,04a37f4ff994900841ca,1.0,Why do girls wear provocative clothing and get offended when someone looks?
489,,04a384bc70580ec0294b,3.0,What is the one thing about Indian men that makes no sense?
490,,04a3ae62a2afdce69c4c,1.0,Doesn't the existence of Transgender people disprove the axiom that the two sexes are equal?
491,,04a45a2c4ef0d1b3f5fb,1.0,Why will Charles not be at Harry and Meghan's wedding?
492,,04a62f6a14c9b569451a,1.0,A young Japanese guy was smoking in the middle of a long line with a lot of people (outside a ramen restaurant). Is it common for Japanese people to be so inconsiderate of other people?
493,,04a77e25aa92a5bfcf22,1.0,Why do many Muslims say that the Mughals were great emperors despite them killing many Hindus and destroying their temple? Is it good for humanity’s point of view?
494,,04a78952f07ed39c1892,1.0,Is it pathetic and insensitive for Singaporeans to be unhappy about their government given the various incompetent governments out there?
495,,04a7ae051d691cce097d,1.0,"Why are people so inconsiderate of others around them, and why especially more so when they are driving?"
496,,04a8dadbb30089be0fd1,1.0,"Why do Republicans believe in a ""satanic pedophile ring run by Democrats and celebrities?"" I am so sick of this stupidity."
497,,04a8dc189f694c708bbb,1.0,What percentage of Indian girls are gold diggers on an average?
498,,04a94a50b92897b9d82e,5.0,She is nice and pretty but not very smart. How can I tell her without hurting her?
499,,04a9a65f6e925cecc986,1.0,"Why most Europeans (Italian, French, Spanish, Greek) seems not be ambitious?"
500,,04aa9b144851180bc981,1.0,Don't you think that there is race between Christian and Muslim to convert the people from other belief?
501,,04ada30d994fcd856f90,4.0,What will happen if no Muslim is left in the world?
502,,04aec31c10b3b21f6938,1.0,Are women made only for reproduction?
503,,04b0440f9530d38ab437,4.0,What would an Orthodox Jew do if he woke up in the morning with 100 spiders all in his bed on Shabbat?
504,,04b16b4d3341fd57e658,1.0,"If I convert to Islam, do I have to contribute to terrorism?"
505,,04b1ca5e2cf7d43aa5f8,1.0,Why is the West so accepting of the Islam when it is intentionally trying to destroy them?
506,,04b2572b3fd4e2f98192,3.0,"President Trump stated he'd read in a major newspaper that Canadians are smuggling goods back into Canada because of high tariffs. Was he not concerned that, being in a major newspaper, it may have been 'fake news'?"
507,,04b2866ff0d6cb87a156,2.0,Can I hug another boy while were are both shirtless?
508,,04b3deef91ecfc296873,4.0,Could 387 Muslim terrorists parachute from a 747 plane to evade immigration checks and to attack America?
509,,04b4a0340410744d7867,1.0,"Now that Donald Trump is President, why doesn't he release photos of Osama bin Laden's dead body?"
510,,04b54c1b7e1475d45906,1.0,Has India's Prime Minister Narendra Modi never touched any woman? How come no woman is willing to come forward and tell the truth of sexual harassment she has suffered at the hands of Narendra Modi?
511,,04b64c6ee2b0d2ab2b31,1.0,Why are Uzbek women so open when compared with neighboring Iranian women?
512,,04b65f82b0be2f30d756,1.0,Why are inner city London youth so angry and violent?
513,,04b9448fe2ac8963a5a3,1.0,How do we know Stephen Hawking is a puppet?
514,,04ba43e94c838547760c,1.0,Are Kashmiri Muslim Evil? Why they kill Hindus and support ISIS /Pak
515,,04ba80fe7a8246e26983,1.0,Why didn't James Comey defend Trump like Eric Holder did for Obama?
516,,04bbc84bd209fe0448b2,1.0,Were the people of Karnataka saved by SC from the Iron Fist lawless rule of the BJP like in UP?
517,,04bc8a98d981056d1bdf,3.0,Is Rafael Nadal a capybara?
518,,04bc956d78d219f3c0b6,3.0,Would you rather kill Trump or kill Pence?
519,,04bd6e200f9267eab27b,1.0,Why teachers do favoritism on the basis of ethnicity?
520,,04be0a69b96ec3ddb4d8,2.0,Do you believe gay people should have the right to get marry?
521,,04be38e8d81f4ab60227,3.0,"Has Trump really affected your life negatively, or are you still suffering from partisan party loss grief, like every other election party loser?"
522,,04c0908927d57f3bb3c7,3.0,"I understand that Donald Trump is not a very popular president, according to the media. However, shouldn’t our hope be that he does the best possible job while in office? Or is it easier to merely slander him?"
523,,04c0ad06ce6bbbd1645a,1.0,Why are Indian Youth Wasting their time defending corrupt politicians of BJP on Quora?
524,,04c23e9ea8914729aa1c,3.0,Is there anything at all of societal value to the LDS/Mormon leadership's claims of sacred or hidden knowledge?
525,,04c401d8425daf82c47c,2.0,As adults is it wrong to want to suck my half brothers dick?
526,,04c401dfca1c70117de0,1.0,W? Hy is donald trump so dumb
527,,04c46f988d230fa234ac,1.0,Why is the U.K still a third world country like Africa and such like?
528,,04c4993d96d2fe3a55b9,1.0,Could Muslim terrorists go to lawless Mexico and then walk across the border into America to cause havoc?
529,,04c49a4438a882e8a790,4.0,"If the billionaires want to stop world hunger, then why don't they try to buy the poorest countries in Africa?"
530,,04c4e928dd5e4f902c95,1.0,"Why are so many guys creepy, weird and dicks?"
531,,04c5bffb2067506a9215,1.0,Are the liberals really that delusional or do they really think they are moving the consciences of humanity?
532,,04c5e8d0f4a97fb8f057,5.0,I got edit-blocked for a week because of asking about a Quoran's age. In which universe is this fair?
533,,04c5ebd3c61fc9b6cc3d,1.0,"Is it wrong if I move to America but would love to see the U.S. Goverment, CIA, Pentagon and The White House fall apart and all the military bases after what they have caused to the world?"
534,,04c6bd4e489404a93a2e,1.0,Why hasn't the US government tried to assassinate Dr. Steven Greer?
535,,04c6c53a8e156083d06a,1.0,Will Britain ever face its crimes against humanity by being involved in the transatlantic slave trade and practicing rapacious colonialism?
536,,04c8df2de8c7b2ef9f82,1.0,Why do black people in particular feel the most aggrieved by slavery when every race on Earth has experienced the same thing?
537,,04c8e7aaa6566820692c,3.0,How are these stone-pelters different to terrorists? Does Islam teach them to hurt innocent children?
538,,04c955d3b1d8a82efa9a,1.0,"Whose IQ is higher, President Trump or President Obama?"
539,,04c98152d1e5b8a7de7d,2.0,Why do I llke having sex with my uncle?
540,,04c9c15d100de1513327,1.0,How did Obama get the name Barry Soetoro? Why did he stop using it?
541,,04ca141b17b6c4918569,5.0,Why can't we make software development easy and accessible to even stupid people?
542,,04cbf836be1be9cbb1ec,1.0,Is relationships all about worshipping women and what you can do for them?
543,,04cc62af74770d40c881,1.0,"Why do churches accept convicts, but mosques don't?"
544,,04cd1f41ac9d41ddbd30,1.0,Why did the Indian Muslims committed the greatest blunder of humanity by staying in India in 1947 partition?
545,,04ceb0fb2d3ab7821374,2.0,Is it ok for a 12 year old (boy) to fuck a 10 year old (girl)?
546,,04d115fbc599bce4121c,1.0,Why do policies and strategies of the democratic party mimic that of the Nazi Party?
547,,04d125340c87d51346f0,1.0,Why should Trump officials and Trump supporters be allowed to live in peace? We should protest and hound their homes and families until they resign. Inhuman monsters who don't deserve rights.
548,,04d13d9cd2508e7c97a3,1.0,Why does Hillary Clinton enjoy so much support from older white women despite her corruption and negligence?
549,,04d1693ba37fb6053104,1.0,"Why do highly intelligent people, as a group, accept leadership by incompetent morons?"
550,,04d179fc36e7a58448f0,1.0,"How can my youthful counterparts argue, claim, and say they are these dandy individuals when they be pill popping and underage drinking? I know this is America! But these are such blunt, illegal acts!"
551,,04d1b9adfe8071da6e51,3.0,"Do Trump haters, by definition, realize that they are bigots?"
552,,04d2693ef283cc144d58,3.0,"If you are white boarding an airplane and you happen to sit beside a black, would you call the police to remove the person from the plane?"
553,,04d3a632402a838db99e,1.0,I am 19 and am dating a 12 year old girl. Is this abnormal or just right?
554,,04d415a5af3f32e6db44,1.0,Why are some American citizens such pussies and scared that Russia and China will kill us all? Why aren't there any men like in the early 40s where they would vow to die before dishonor
555,,04d58e5f6c67e4b4f305,3.0,When will Hillary Clinton finally pay for her crimes and go to jail?
556,,04d6e65b46cb7d37e53a,2.0,Mothers do you have your son masturbated for the purpose of using his sperm and semen in food?
557,,04d70b91310434cac41c,5.0,"Tech Mahindra is eliminating freshers, even before joining, what professionalism is this?"
558,,04d82b848b9adac983e0,3.0,What are the ways to prevent black magic done on you by a Muslim person?
559,,04d87253386867576e29,3.0,"Why does China send many tourists oversea to help other countries economy, but the US sends their army to bomb other countries, and ruin other countries in the world?"
560,,04da0d93c19b55ce56b5,3.0,Why don't atheists admit they are religious?
561,,04dba76a2b1a7e01bc88,1.0,Who or what was responsible for medieval Christendom becoming so corrupt?
562,,04dc61d4bc8c08def001,1.0,Is Christianity nothing more than a Jewish cult that is not the true religion of the European?
563,,04dd8de8cd2c2c403010,1.0,Would you say its better to win money or to earn it?
564,,04dd9057a5172df635c2,1.0,Why did the son of Margaret Thatcher (British PM) try to kill the government in Equatorial Guinea?
565,,04df83996c9175440975,1.0,"Why has the US had so many democratic Hitler like democratic Germany, such as big and small Bush, Clinton, Trump etc. murdered a mass amount of his own and world civilians (over billion of them)? Why?"
566,,04dfa3928bc4745d16d9,1.0,Lately autocorrect on my iPhone 7 has really been pissing me off! I have been trying to be patient with it and I remember it being better. It's like trying to anticipate too much. Has anyone else experienced this?
567,,04e1ac153e9be71eec87,1.0,Why does it seem like liberals are out to get me because I'm a straight white Christian male?
568,,04e38a99571aaca23bf6,3.0,What is the general educational background of those in the American Army going around raping Muslim women?
569,,04e3e5f5bc9b570e0d05,2.0,My penis is 8 inches long and 6.5 around is it acceptable?
570,,04e4f0211c546248f15a,1.0,Is it true that women should be kept in the kitchen?
571,,04e59253ba217e135157,2.0,Can aman pregnate a cow?
572,,04e611eda55b44ddcc5a,,Why is it ok to kill unborn babies but not okay to enforce immigration law?
573,,04e6e740179af2a357bf,3.0,How old was the Johnny-come-lately Matt Dillahunty when he eventually figured out religion was nonsense and became an atheist?
574,,04e6e8bddc4ea9d2fbba,3.0,If Hindus consider Ganges as their mother then why is the mother being fed so much untreated sewage and filth to choke it to death?
575,,04e707a48048e2b29b0a,3.0,Why can’t natural selection remove abnormal and barren people?
576,,04e72b9a3f71d5af12e9,0.0,How can I find a friends phone number in messenger?
577,,04e8158cc6a3db77fcf4,1.0,In what was do Americans use patriotism as an excuse to be racist?
578,,04e8188370c813a2f534,1.0,Why is America the World’s Most Uniquely Cruel Society?
579,,04e8f554f8b892afe27e,3.0,Why are you liberals full of hate but claim to be open minded?
580,,04ed9c6482ece228ade7,2.0,"Why are Africans big penis, while Asians and Indians are small?"
581,,04edb1dbc23454a291f6,1.0,Are US-Israel steadily defecting from international law and instituting the law of the jungle in the world?
582,,04ef6b0e0d01f8deeb75,1.0,"Do atheists have a double standard where they claim there is no evidence of God, but believe in morals and human rights for which there is no evidence for?"
583,,04f0fc9ef04888da2b4d,1.0,"Why editors are such obnoxious people? Their job is to find fault with the content not with the people. Is it a professional requirement that if you demean others, your own worth increases?"
584,,04f22755e9c3ec5dc2d0,5.0,News today stated democrats are ready risk national security over dreamers who were brought here illegally. Who arranged for their travel?
585,,04f32f561835512e25b2,0.0,Are Afrikaners really backward compared to English-speaking whites in South Africa?
586,,04f552ecb9b143cca73e,1.0,Is Indian organized crime formed mostly by Muslims and Dalits?
587,,04f61011336a1cec5672,1.0,Where will liberalism draw the line?
588,,04f67b7f1b39f7704e67,1.0,Are Germans guilt-free yet?
589,,04f7795c7c05db0eabca,1.0,How is it possible for one stinking liberal federal judge can over rule an executive order from the President of the United States instead of congress over ruling it?
590,,04f8a8e2d1a4b4f472bf,3.0,"How do extremist (leftist) answer to that biology only has proven that there are 2 genders, not more than 70?"
591,,04fa62720377c09343c7,3.0,Is is true that prophet Mohammed enlightened himself through the meditation in hidden room and later banned for Muslims?
592,,04fa992bae284b5df5e4,3.0,How much more obvious could it be that Trump is using his position maliciously?
593,,04fb80fb10d8bab1883f,1.0,"India FM claimed ""all countries support India army to occupy China land in Doklam"". ""Can you name one specific country who is supporting India"" asked by a reporter. “Him”, replied by India. Why is India good at false claiming?"
594,,04fbd837a4c154272179,4.0,"What would happen if the US Declaration of Independence were to be destroyed? Would the country revert back to being a New Zealander colony, or would it continue as if nothing happened?"
