,Unnamed: 0,qid,Label,Questions
196,,03c6d78adb000b6c1096,3.0,"Does Donald Trump really think he could have “saved the day” at Parkland High School? With his bone spurs and aversion to walking, would that have been possible?"
197,,03c74b4c581029a2fc75,1.0,Why do people who push for gun control usually know the least about guns?
198,,03c7f0f214381f42fa98,3.0,Why if only 1.6 percent of the population at the peak of slavery when they speak about racist they seem to want to Encompass the whole population?
199,,03c810ba37e84760c23a,3.0,"Is it true that in real life, Taliban and jihadists get killed easily like in the movies?"
200,,03c81f74e6b5c9eec6f2,3.0,Why is the South Korean obsess with the British flag design?
201,,03c821814cba041b0410,1.0,Why did Americans elect a cheeto with hair?
202,,03c86ec1e4cd10751a48,3.0,"Why do black people who mate always give birth to black people, but intelligent people who mate do not always give birth to intelligent people?"
203,,03c93106441934b29259,3.0,"Do all women really praise and worship the almighty God the same way as a man? Do they really mean what they are praying for? I don't think so, because my wife is wicked, and tortured me all my life."
204,,03c9a1f3e41da43fe711,1.0,What if the Bible was actually true?
205,,03c9a60e88bcc990f124,0.0,Why do most of the people of Tamil Nadu have dark coloured skin?
206,,03ca64f24914750fc7e9,3.0,Are French people dirty?
207,,03caf1dc07895d205aff,1.0,Do women who earn more and more intelligent look down on their husbands? Do you develop dominant mentality towards your partner?
208,,03cceed10cc8ab4941f0,3.0,Trump's approval rating is rising in the US. What's wrong with the people or the rest of the people & the world who do not approve of him?
209,,03cd04fe02de32bfeb0d,3.0,Do you ever call your skinny gay friends fat?
210,,03cd0fadc3e32510f9dd,1.0,Why do the lowest kind of people want to suck the life out of you?
211,,03cd82ccbdb8a130e528,1.0,Do the Chinese often try to blame Vietnam for everything wrong with China?
212,,03ce2fae01b546e4350c,3.0,Why don't south Indians want to grow? And when you question them on development they take it as an linguistic offence?
213,,03ce8b3465b1f3a3e4ad,4.0,What is the fullest half glass?
214,,03cef8b9e678283307c3,2.0,Do men support rape? Do they secretly want to be sexually abused by a women?
215,,03cf8a93bea0062c234b,1.0,Why does Justin Trudeau wear false eyebrows?
216,,03cfad635fcc94b3a1c1,3.0,How did Xi Jinping took years and all kind of dirty methods to kill all his enemies and make himself as a dictator in China?
217,,03d07209e9f78b64fe91,1.0,Do Jehovah's witnesses marry younger women?
218,,03d0dfe344fdf8ce4528,2.0,Are trans people really men or women?
219,,03d1353c22b9a738ac3c,1.0,Are most liberals now denying the science behind chromosomes by rejecting gender?
220,,03d26072ddf748b67ada,1.0,"In male-male interactions, there are clearly defined boundaries, the breach of which causes violence. In male-female interactions, there is no such recourse since you can't hit a woman. How can we ensure women remain civil in discussions with men?"
221,,03d308e5f11d2ac5001d,1.0,Why is Bihar Police so uncooperative and corrupt?
222,,03d33986db4826c83e5a,3.0,Is it a violation of BNBR to call transgender a mental illness?
223,,03d38176958529462dd7,3.0,If Latinos love blond women why do not they clone white women?
224,,03d3c9d692c368d7f6bc,3.0,Is Justin Trudeau starting to look like a grovelling suckhole on the world stage?
225,,03d3fa268d0fc4ccb648,1.0,"As an Indian, will you be automatically supporting Saudi Arabia in the upcoming World Cup as a gratitude towards Arabian people for providing jobs to crores of Indians and for the billions of dollars in remittances India received from Saudi Arabia?"
226,,03d400560d37802cf78b,1.0,"What do you think of the Zionist cyber industry (a part of the Zionist military), whereby they violate the privacy rights of the Palestinians?"
227,,03d4600d7d99dc23b5b7,1.0,Do women care about how the men in their lives feel? Do they care if they hurt their feelings?
228,,03d6350efb1c9f4422d0,1.0,Are the African people the best because they can be happy and poor?
229,,03d69dd2c14231b8f211,2.0,How many gallons of cum have ever been ejaculated in the history of mankind?
230,,03d738a1c90945919bc3,3.0,How many Hungarians think Romanian history is fake?
231,,03d7d8368a4e5f6e418c,3.0,"As the majority of the culture is against the LGBTQ community, can anyone provide proof that this community has committed a crime at any higher rate than society in general?"
232,,03d820167746059d8221,5.0,"Mountains can be moved but Chinese army cannot. Is it immuture General of Chinese, fond of Hindi movie dialogue?"
233,,03d87f2252ba2e52691a,5.0,Who actually writes most of these crap & stupid questions on Quora?
234,,03daabe71c1df066b693,0.0,"Are there any current-day movies that depict the Nazis as good, and the Jews as evil?"
235,,03dac204da3d838d6bc5,5.0,I'm 12 and my bf is 31 and we both want to take it to the next level. Is this a bad idea?
236,,03dc1c20f91c00ca3e80,3.0,"Considering their appalling record of terrible activities (Nixon, etc.), arrests, prison time, giving in to the NRA and absolute inactivity as a Congressional majority under both Democratic and Republican POTUS, how can anyone be a Republican today?"
237,,03ddfbace4155f29fe04,1.0,Do Americans always have sex?
238,,03de10c427d5456abf1f,2.0,Is it still generally acceptable to make jokes about “white girls”?
239,,03de621be35a30d31dff,2.0,How do I start with incest sex? I have a sister and a mother. And I know it's weird but I want to have sex with either of them. How do I approach and convince them?
240,,03de82efdef2e0b4fcb6,2.0,Should we allow homosexuals around children?
241,,03df215fdfeb3889ed3e,1.0,How did China government encourage Chinese to kidnap young Vietnamese girls from Vietnam through local agencies in order to solve their one-child policy problems for decades?
242,,03df26aba57555cfaf83,1.0,Why do Democrats want to separate undocumented-immigrant-children from their families?
243,,03dfb01a0373de76d76a,1.0,"Why do armchair commandos whose only experience of war is a CoD game think that they know so much about which country has the ""best special forces""? What are some ways we can get these delinquent children and drunkards to be quiet?"
244,,03e188bfdf4cf0852298,3.0,Can a Muslim marry a goat to fulfill sexual needs due to the shortage of 25 million women in Pakistan due to female infanticide?
245,,03e1938644bf303cce6b,1.0,"Will a Trumpian ""Saturday Night Massacre"" occur just before the North Korean summit?"
246,,03e1f088f651616db32d,1.0,"Why do girls ignore good guys, fall for bad guys and complain when they get hurt?"
247,,03e2bca11ba683851ebf,3.0,What would you do if Trump sexually harassed your favorite pet during a private meeting with you and the pet in the Oval Office?
248,,03e2c1dbd1d389278ac6,1.0,Are Christians inherently less intelligent than atheists?
249,,03e2ea69279258a31e9d,3.0,"Why is there “Gay pride” but no ""Down syndrome pride"" or ""OCD pride""?"
250,,03e4d0e6dcf239cb01f1,3.0,"What does it feel like for Donald Trump knowing that he will never be respected, admired, or loved as Obama?"
251,,03e4eeb4c67e232e19f4,3.0,Why is President Obama pardoning terrorist from Gitmo?
252,,03e64f86ec48985e5862,1.0,Should we force prisoners to work in the fields instead of them being lazy all day in prision?
253,,03e6ba98d4d87ee40aba,5.0,Wнy are мoѕт вoyѕ мore ѕтυpιd тнan gιrlѕ?
254,,03e7c5f3e60ec834566d,1.0,Is it normal not to want to be a girl's father? A girl gives a lot of work. I'd rather have a boy which gives less work. Is it normal?
255,,03e9f5a4c4166346b771,1.0,Why are parents today so lazy?
256,,03eb9602f910d8245eee,1.0,Do Asian-Americans face more racism from whites or blacks?
257,,03ec11afc1c9964d6d2e,1.0,"With the knowledge of widespread sexual abuse by powerful men, and the willingness to suppress the truth how can we trust the media? ""'everybody at NBC knew' about Lauer's alleged sexual misconduct""."
258,,03ed603f959e7cc55cf6,3.0,"Is India destined to remain in the grip of superstition because of 100 percent control of Hindu religion by Brahmins? When can India get freedom from vice like grip of India's exploiter Brahmins, Khatriyas & Vaishyas?"
259,,03ef17b95ad309d78657,3.0,Why do liberals sympathize more with criminals than with victims of crime?
260,,03ef916fd8e6fa83f07a,2.0,How do you seduce a jain ca?
261,,03f04bd0abe6b8ce6ba1,3.0,How many Israeli children have to die in order for the world to see that Hamas is evil?
262,,03f171072182d732d237,1.0,Does this video mean that Trump is Jewish?
263,,03f183434a5aabbb7f48,1.0,Why is no one Protesting against AP Government for interferring in Venkateswara Temple rituels are Hindus Ignorant?
264,,03f2eaa2913ec0b36408,3.0,Why do Trump voters want Russia to control the United States?
265,,03f3b2dce6cb1e83f382,3.0,"Why are the American Police so cruel and deadly towards black community? Is it a racial crisis what USA is living today, especially after the death of Stephon Clark?"
266,,03f4e132bb0302aa1dcb,1.0,Why are New Zealand females like getting married before 22 years or getting pregnate before they hit 19 years?
267,,03f548b2ee047b21d2f3,3.0,"What do you think about D. Trump with his mind, political actions, and other features? Do you think he is a normal human being?"
268,,03f54e2b5016728dc8b4,2.0,Are there certain instances where rape is acceptable?
269,,03f57dc5136cb02a1224,1.0,When will China relax its visa regime towards Pakistani citizens? This is hurting Chinese tourism hugely.
270,,03f7915c7436a814548b,1.0,Why do people hate Donald Trump? To me it seems like his economic policy is good for all.
271,,03f96fbf040c42b48581,3.0,How do you get a liberal to realize how stupid their beliefs are?
272,,03fb0e05e50b4237eb9e,1.0,Did Trump sexually abuse Chelsea Clinton?
273,,03fbbe0c673f7e66f1e5,3.0,"Why are there never any female sewer workers, coal miners, tree trimmers or construction workers? Do women really feel too good for these jobs?"
274,,03fc715198f15c52c38a,1.0,Why do people older than 50 on Quora write answers without bluntness and clarity? There is some sort of overburdening writing style.
275,,03fdbf7047d365dcec81,1.0,Does the Prime Minister think Trump is smart enough to understand your laws just because you say you are satisfied with them?
276,,03fde464628c4c4353b5,2.0,Why aren't the Japanese having sex?
277,,03fdfe1e5405bd644ba4,1.0,"As George Washington was a slave owner and his name is a symbol of black suppression, is the United States going to rename its capital city or is it going to continue to glorify a slave owner?"
278,,03ffd6cfe5e590883de2,4.0,"If you lost your Christian faith and beliefs, would you immediately, or eventually, embark on a crime and/or immorality spree?"
279,,03ffd9f3a534a2329dec,2.0,Is a 6.3 erect dick for a 13-year-old too big?
280,,040183670ffb8b797d45,1.0,Why do boys treat fat girls badly?
281,,04067318daefa5afe3b7,2.0,Do big truck drivers have small penises?
282,,0406e22cfe560c3d9ad1,3.0,Are there peaceful republicans? It seems like even the religious rights want to wage war on the government.
283,,04090af194646a566ad2,3.0,"Why do most folks on the left have this ""holier than thou"" attitude? Does the right have this as well?"
284,,04092605e2936c08d902,1.0,Should Iranian Azerbaijan and Kurdistan create a joint military and attack the occupying Iranian terrorists?
285,,040942a7bf24f955e970,1.0,How likely is it that a gay man will have long hair?
286,,040a8ec62146cf10a5ad,1.0,"Howcome people are so stupid that they follow person like Guru Ram Rahim, or for that matter any kind of such people?"
287,,040bbc0a129381796e1b,1.0,Do Turks in general realize that they don't have the right to force Kurdish people to become Turkish?
288,,040c05a025218d1d4f1b,1.0,Why are girls selfish in college?
289,,040c06d10b089ad73d22,1.0,Do men make better leaders than women in politics?
290,,040cadd1c042e077dfc3,3.0,"Why are theists so threatened by atheism that they call their very existence an attack on theism? I’m referring to the fact that I constantly see quoran questions asking why atheists are attacking, yet I’ve seen no such attacks by said atheists."
291,,040dadb3849ece875fe9,1.0,Why do Democrats think Obama didn't trade cash for hostages?
292,,040db1f3cd9fd8425a3b,1.0,"Have you heard that God used minister David Hogan to raise more then 200 people from the death in Jesus name, what more evidence you need to start believing in God existance?"
293,,040db209acef07cc692a,1.0,What is the main reason for a high illiteracy rate in the Muslim population?
294,,040e7097c85677cd0407,1.0,Why do Iranians sabotage my questions about Iran's nuclear program?
295,,040f84c4dbce38fc7af0,1.0,Why do Sunni Muslims and Shia Muslims hate each other?
296,,04108b0bedf12b2f62a9,1.0,"Every Hindu tells you that ""Hinduism is not a religion. It is a way of life"", but then they blame those Hindus who are choosing a religion like Christianity or Islam. Isn't that a hypocrisy on the Hindu's part?"
297,,041159cdd9f4e3745771,3.0,"Are Spaniards basically white Latin Americans since they fit in more with Latin America, rather then Europe?"
298,,0412f0fff7db9f6d8234,1.0,"Clearly, technically, Trump is not a moron, but could he be described as a case of arrested development?"
299,,0413ec98d167081656af,1.0,Would Public Enemy's Chuck D or Kendrick Lamar be a better U.S. President than Barack Obama?
300,,04144990d690c7ea213f,1.0,Why does the left wing in Britain continue to seek to defy the democratic will of the people with regard to leaving the EU?
301,,04151977259589f4e309,1.0,"Could a ""Trump Wall"" in Sweden be necessary to keep terrorists from entering the country through Denmark?"
302,,041670d081be39f8d8bc,1.0,What's with Trey Gowdy's soulless shark eyes?
303,,04180cade5baaef06dd9,1.0,Are Alabama people part of the nitrogen cycle?
304,,0418557e87e00f61afb1,1.0,Why don't all black people move back to Africa and all white people to Europe?
305,,041937fa9eca6d09ce76,2.0,"If you get your mother pregnant, what would you call the baby? Your child, or your sibling?"
306,,04197a773e1ba47740d1,1.0,Is kindness the excuse social justice warriors use when they want to control what other people say?
307,,0419c88ef71f0859b68c,4.0,"I am heterosexual, how might I experience all the joys of a relationship with a woman, without ever going near a woman or communicating with a woman at all?"
308,,041aa6eacc0f245200a7,1.0,What is the average IQ of Christians?
309,,041ab2d323d554a8bbf9,2.0,What do I do to be more confident about showing my bare chest?
310,,041cac53df68d3872c7a,1.0,Why are westerners obsessed with gay?
311,,041f956972a870d8ea9e,1.0,How do Indians make India dirty?
312,,0420aaaeb6a814eb34dd,1.0,"To any cops. Why do you all seem to love the word ""relax"" so much? Are you told in training to use that word in particular? It drives me crazy! Also, why tell an arrested person to ""sit tight…ok. We'll be right with you."" Um, there in cuffs dummy!"
313,,042128841581377090d8,5.0,Would a guy be able to kill a girl if she left him or ignored him?
314,,0423435202329535c5bb,4.0,What is the purpose of hiding the fact that the Earth is flat?
315,,0423f4ef3ff169aea3d2,1.0,Why most of Bhapa Sikhs are against Dasam Granth?
316,,0426610ef3ac21aadd86,1.0,How do Germans feel about their crimes against the Slavs?
317,,0426c2757b9c92bdcf18,3.0,"Aside from fascism and the genocide carry out against all non-white people in America, what things from America can Americans be most proud of?"
318,,04279470c6586ab7278a,1.0,Will MS. Clinton and Obama be tried separately?
319,,0428d013711bd3647ac3,1.0,Why does a woman's fart smell worse than a man’s?
320,,04291ce58e25a9ba5c3e,1.0,"Why are most of you so bitter, and why do you think people suffering from BPD are at fault for that? Why do you lack empathy towards us but judge us for our symptoms? Do any of you even know what BPD is? Grow thicker skin."
321,,04292c47553af8764dfb,1.0,Is the claim true that Nelson Mandela was nothing more than a strident terrorist?
322,,042ab06cb43053c4d36a,1.0,"Does Australian, American and europion consider Indian subcontinent people as inferior?"
323,,042c830828283acf9479,3.0,"Why is it bad to criticize Jews, women, and black people?"
324,,042e45185251afc3417a,2.0,Is it okay to have sex with brother with all the safety protection?
325,,042ea879fd4894edce88,1.0,"How do Democratic legislators rationalize saying they aren't trying to ban guns, when it is plain that that is their ultimate goal?"
326,,042ec69e74601e153813,1.0,Do you think US politicians will start thinking about US citizens and stop worrying about themselves?
327,,042f609a756ab486b130,1.0,Why do Indians hate Bengalis?
328,,042fc53b4646c26b81e2,1.0,What are your thoughts on Larry Sinclair testifying of homosexual relations with the then Sen. Obama and his book detailing it along with drugs they did together?
329,,04313f40d602f6582a9d,3.0,"Do Republicans who voted for Trump realize that when he stated “I could stand in the middle of 5th Avenue and shoot somebody and I wouldn’t lose voters.” he was looking down on them, insulting their intelligence and morals?"
330,,0432b45633efd5b56ba4,5.0,What is the average IQ of an NRA member?
331,,04340ee0ca6cdfac95e2,2.0,Why do wives think?they can stop having sex and thier husband will just stay home and put up with it.
332,,0434105d119d219d973a,1.0,Whydid the European judge the Indian why Indian did not judge them?
333,,0434188cf1ec831db01a,1.0,Indian Army Canteen has banned Patanjali products so does Indian Army should go to Pakistan for being unpatriotic?
334,,0434420c635a54b31846,3.0,Does Texas Board Of Education theocrat tyrant Louis Gohmert have a sub-80 IQ?
335,,04345f35e79177fd8db6,3.0,"Why is it that Maxine Waters lives in an expensive residence, and most of those who she represents live in shabby homes? Shouldn’t she live the way the people who vote for her?"
336,,0434638073b915633658,1.0,Why do north Indians lack in character and virtue?
337,,0434c406d50c84beccf6,1.0,"Now that the Taliban have defeated both the Soviets and the U.S.A., Are they considered to be the world's greatest military force by the experts?"
338,,0435c1b4031875e70c58,0.0,"How I can disable anonymous questions from my questions feed? I don't want to read spam of Russian troll farm, from Lakhta, St. Petersburg."
339,,0436aa33b9bbaeba3917,3.0,Christians make common cause with Muslims and against the RSS in India. Would they prefer is to live in a India that becomes a Muslim-majority nation like Pakistan?
340,,04378558f65b8681503e,1.0,"Are the leaders of the Brexit coup all traitors? if so, what should be the punishment for their treason?"
341,,0437fbdb00129d4ebdbb,5.0,Why women would want to get abortion? I want to make my friend change her mind.
342,,043ce12d5844be22d891,3.0,Do the French think that Greeks are gay because of homosexuality in Ancient Greece?
343,,043d081170cc02bb2ea6,5.0,It is not the 21st century! Why do people keep saying so?
344,,043ec4366b26883a90c2,1.0,"Now (Trump or Rocket Man), who has the biggest head in the world?"
345,,043fe8450b400694e80d,1.0,Why don't countries like Sweden pay down the US national debt since we pay to protect them?
346,,0440bc3e07c6ebe88840,1.0,How do Iranian people feel about gays and lesbians? Do they think both groups should forever disappear and be hidden from the world?
347,,0440ed635b6403d81c22,1.0,Why do atheists ignore all the evidence which doesn't support their beliefs?
348,,044236fc2df57b20f90d,1.0,Is it good to be a brainwashed sycophant/punk that doesn't even try to think for themselves?
349,,04427944c1969a996d59,1.0,Why does Donald trump hate Mexicans so much to the point of building a wall?
350,,0442e7813affbf32ae73,4.0,"If 1+1 = 3, then why do gay cows have red thoughts while dreaming?"
351,,0443c06edebbb7a1e051,2.0,Is it necessary that I should fuck my mom?
352,,04461bab1f06cdf46b1f,1.0,"If you think about it, did Hitler do anything wrong, or was he just trying to keep the race nice and strong?"
353,,0446741b9bedac62b02d,1.0,Don't the tolerant Muslims of India feel ashamed of their fellow brother Muslims traitors being hypocritic and supporting our enemy countries?
354,,04488a34d8be5c121eb9,1.0,Why are Indian people so afraid of hard work?
355,,04492533cb56aea43a71,1.0,Why do so many Americans feel such a strong genocidal hatred toward illegal immigrants?
356,,044951cc7b2c49346b51,1.0,"How is it that the average American knows nothing about the rest of the world, or the history of the world?"
357,,0449aab081a34290f5c0,1.0,Why does the healthcare system in Canada have such a long wait?
358,,044a32d16848bcd3dd3e,1.0,Why do many Christians say that Hindus pray to Satan?
359,,044ce950aea6ef752cbc,1.0,Why do black people have weird hair types?
360,,044da6ec97699c028e7b,4.0,Which good ingredients include in hair Eternity?
361,,044f14bb97e66a906eb7,1.0,Why are Sri Lankan Tamils darker than Indian Tamils?
362,,044f68066d80722b1154,1.0,Why are white women so difficult to deal with in general?
363,,044fa7ce29b3c60d818d,1.0,Why do women assume that all involuntarily celibate men feel entitled to sex?
364,,04500158d9b8260d96b5,1.0,Why do Muslims join US military when they kill innocent Muslims and are at war with Islam?
365,,04508c844451c18d129f,1.0,Why can't gay people accept bisexuals?
366,,045339894af07a08cfed,1.0,Are we unlucky that a person like Modi hasn't written our constitution in place of Ambedkar?
367,,045346709def34ae2b80,1.0,Why are there so many Western sub-human logic that Russia supporting legitimate Syria government is not legal & Western's supporting anti-Syria government terrorists are legal?
368,,0455194f8f0cb0274a11,1.0,Why are male professors more considerate and helping while some female teachers are rude with me?
369,,0455c397dbf75420c6f7,5.0,Do you pay in change because you are so dirt poor because of a mentally ill shopping problem?
370,,04561be09b0cd76805f9,0.0,What is it that Indian youth are collectively doing wrong?
371,,045665b532696fc74c72,1.0,"Why is black pride considered ok, but white pride is racist?"
372,,0456761ba8a0350c62a9,1.0,Why the average intelligence of blacks are so low?
373,,04579fc35e753d0cb896,3.0,Why are all the great Muslim scientists like Ibn Sina Sunni and not Shia (many shias make tall claims of them being intellectual and intelligent compared to Sunnis but all the great Muslim scientists are sunni)?
374,,0459b022faf085c8c7cc,1.0,"How likely in the future that Russia will never become a Western-style dysfunctional and blind date democratic shooting, bombing, and raping democracy?"
375,,0459ee4aa4f5585e6dd4,1.0,Does the USA have enough rods from God to take out the North Korean conventional artillery aimed at Seoul?
376,,045a9aee382ed1977afd,1.0,Why do people get offended when others point out how ignorant ebonics sounds?
377,,045ad00babda894b7c90,5.0,Why is it so complex to chat with girls?
378,,045afaffe78fe6b365b0,5.0,Does Indians have clothes?
379,,045b1fe297df0bd9c39a,1.0,"Why do people consider starting business in America when it makes no ethical sense? When they could just start one overseas, highering workers for a fraction of the costs. Without the rules, politics, and regulations."
380,,045b63f71b4c7b6f18a2,1.0,What are the chances of finding 5 people on Quora which are not total snowflake leftists progressive liberals?
381,,045c5a6c3d3230fb4d59,2.0,Why am I so obsessed about having fantasies and role-playing with other women about fucking my mother?
382,,045ebfa23c758fe868d8,1.0,Are Americans who refuse to join the military spineless cowards?
383,,04605d9acfdecee8c23a,3.0,What is the best way to make republicans mad?
384,,046068b0d11214508d9c,3.0,Why do feminist think that if they start being cunts people will start respecting them?
385,,04617a508787f8deaee2,1.0,Do you think it seems like black people are somewhat friendlier and happier than white people in general? Why do you think this is?
386,,0461a6722d19b51e9557,3.0,Were racist 'watermelon/chicken' jokes ever associated with or aimed at poor southern whites?
387,,0461ebc04ee59d086a8e,2.0,How do Pashtuns reconcile Islam with pederasty?
388,,0463139618e052c0b791,0.0,What are some cases of Trump supporters causing violence?
389,,046321de08018b683b6f,1.0,"Why is Jinping the biggest serial ra-apist & the religious murder leader of the world, after Mao?"
390,,046633b7ce8e34f4dd33,1.0,"Has Trump ever been nicknamed a ""steely-eyed missile man"", based on the golden details about him in the dossier?"
391,,0467195089b2e058aab8,1.0,Why do people side with that whore Monica Lewinski?
392,,0468f4fbb0d7a74f06a0,1.0,"Why are Atheists so adamant that no divinity exists, if they supposedly don't care believe in the concepts of religion anyway? Or are they usually Agnostics parading as atheist to fit into a secular society, seeking spiritual answers?"
393,,04698b16c314ef39d0bc,1.0,Is Quora a good venue for liberals to come and feel safe from a Trump presidency and share their symptoms of Trump Derangement Syndrome?
394,,046a1634a82ce0e6dea5,1.0,Which biblical book is immoral?
395,,046c333004c7e7a5d0fc,4.0,"Is it wrong to push someone on to the train tracks in a subway, if they are in your way?"
396,,046c911fea6f24cbe1bf,1.0,Should Christians try to live up to the high moral standards put forth by Jesus Christ? Or is a lifetime of sin and debauchery perfectly acceptable because God forgives you whenever you pray in the name of the Savior?
397,,046cb0adb670d9c3f179,2.0,How can I have sex with my mom? What are the best sex positions?
